{
  "schema_version": "alice.report_summary.v1",
  "report_summary_id": "70e1d8e7-3530-5d99-8e59-5593c96b70fd",
  "request_id": "b71f5ba1-f08d-447b-a91a-2a31724cd2f3",
  "land_research_object_id": "d4c0ea20-c6bb-5b80-812f-1f5767bd1c28",
  "parcel_candidates_id": "479533cf-a6c9-51a9-8292-4fac4dd3f424",
  "render_mode": "generic_summary",
  "generated_at": "2026-04-17T01:07:00Z",
  "title": "Alice Deep Research Memo: Parcel-confirmed APN H123-456-7890-0000 in Hudspeth County, TX",
  "one_line_conclusion": "One parcel-confirmed Hudspeth County candidate supports a favorable rural hold screen, but zoning and boundary-based environmental checks remain incomplete.",
  "subject_snapshot": {
    "primary_subject_label": "LandWatch listing 12345678 near 80 Acres near Sierra Blanca (TX)",
    "request_mode": "deep_research",
    "research_unit_type": "unresolved_candidate_set",
    "resolution_status": "partially_resolved",
    "county_name": "Hudspeth County",
    "state_name": "Texas",
    "state_code": "TX",
    "city_or_place": null,
    "parcel_count": 1,
    "candidate_set_status": "single_strong_candidate",
    "overall_confirmation_level": "parcel_confirmed",
    "overall_confirmation_basis": "local_record_corroborated",
    "canonical_address": "County Road 111, Sierra Blanca, TX, 79851",
    "coordinates": "31.178300, -105.337100"
  },
  "evidence_quality_panel": {
    "coverage_tier": "partial",
    "local_footing_status": "partial_local_footing",
    "suitability_for_deep_research": "partially_ready",
    "overall_confidence": 0.44,
    "overall_completeness": 0.274,
    "evidence_quality_label": "directional_only",
    "citation_count": 7,
    "risk_count": 3,
    "unknown_count": 9,
    "official_source_count": 11,
    "listing_source_count": 1,
    "only_federal_baseline_available": false,
    "notes": [
      "Parcel identity and tax context are stronger than zoning visibility in Hudspeth County.",
      "County-level forms provide procedural clues, but parcel-specific development feasibility still requires local confirmation.",
      "Water-rights and utility feasibility remain unresolved without deeper state or local follow-up."
    ]
  },
  "top_findings": [
    {
      "finding_id": "parcel_identity_status",
      "section": "parcel_identity",
      "label": "Parcel identity status",
      "summary": "Parcel-confirmed: County public records corroborate active parcel candidate H123-456-7890-0000 at or near 0 County Road 111, Sierra Blanca, TX 79851. Sources: Hudspeth Appraisal District Property Search.",
      "evidence_scope": "parcel_confirmed",
      "confidence": 0.79,
      "citation_ids": [
        "c_a164adc9"
      ],
      "supporting_source_ids": [
        "county_tx_hudspeth_cad_property_search"
      ]
    },
    {
      "finding_id": "use_case_recreational_rural_hold",
      "section": "use_case_modules",
      "label": "Recreational / Rural Hold Screening",
      "summary": "Parcel-confirmed: Recreational / Rural Hold Screening is favorable at screening grade (evaluated). Screening looks directionally favorable at screening grade. Parcel identity is already parcel-confirmed, which reduces subject mismatch risk. Key unknown: Carrying costs, tax burden, and resale liquidity are not yet well constrained. Sources: Hudspeth Appraisal District Property Search; LandWatch Listings.",
      "evidence_scope": "parcel_confirmed",
      "confidence": 0.824,
      "citation_ids": [
        "c_a164adc9",
        "c_f8a8c354"
      ],
      "supporting_source_ids": [
        "county_tx_hudspeth_cad_property_search",
        "listing_platform_landwatch"
      ]
    },
    {
      "finding_id": "use_case_energy_solar",
      "section": "use_case_modules",
      "label": "Solar Energy Screening",
      "summary": "Parcel-confirmed: Solar Energy Screening is mixed at screening grade (evaluated). Screening has usable supporting signals, but material blockers or diligence gaps remain. Parcel identity is already parcel-confirmed, which reduces subject mismatch risk. No authoritative zoning or local solar-compatibility check is attached yet. Key unknown: Interconnection feasibility, queue posture, and upgrade cost are not yet known. Sources: Hudspeth Appraisal District Property Search; FCC Broadband Data Collection Nationwide Downloads; LandWatch Listings; +1 more.",
      "evidence_scope": "parcel_confirmed",
      "confidence": 0.769,
      "citation_ids": [
        "c_388a298c",
        "c_a164adc9",
        "c_f7b719d5",
        "c_f8a8c354"
      ],
      "supporting_source_ids": [
        "county_tx_hudspeth_cad_property_search",
        "federal_fcc_bdc_national",
        "listing_platform_landwatch",
        "state_tx_puc_electricity_maps"
      ]
    },
    {
      "finding_id": "planning_context",
      "section": "planning_and_land_use",
      "label": "Planning and land use",
      "summary": "County-level: Local planning-related pages were reachable, but Step 7 did not yet retrieve a parcel-specific zoning designation. Observed planning surfaces: Texas StratMap Land Parcels; Hudspeth County Forms and Applications. Sources: Hudspeth County Forms and Applications; Texas StratMap Land Parcels.",
      "evidence_scope": "county_level",
      "confidence": 0.58,
      "citation_ids": [
        "c_8170d536",
        "c_9cc08b9d"
      ],
      "supporting_source_ids": [
        "county_tx_hudspeth_forms_and_applications",
        "state_tx_stratmap_land_parcels"
      ]
    },
    {
      "finding_id": "infrastructure_context",
      "section": "infrastructure_and_utilities",
      "label": "Infrastructure and utilities",
      "summary": "Geography-only: Utility or transmission-related public entrypoints were reachable: FCC Broadband Data Collection Nationwide Data; Texas PUC Electricity Maps. Sources: FCC Broadband Data Collection Nationwide Downloads; Texas PUC Electricity Maps.",
      "evidence_scope": "geography_only",
      "confidence": 0.5,
      "citation_ids": [
        "c_388a298c",
        "c_f7b719d5"
      ],
      "supporting_source_ids": [
        "federal_fcc_bdc_national",
        "state_tx_puc_electricity_maps"
      ]
    },
    {
      "finding_id": "listing_market_context",
      "section": "market_signals",
      "label": "Listing and market context",
      "summary": "Listing-derived: The LandWatch listing asks $240,000.00 for 80 acres, or about $3,000.00 per acre. Sources: LandWatch Listings.",
      "evidence_scope": "listing_derived",
      "confidence": 0.88,
      "citation_ids": [
        "c_f8a8c354"
      ],
      "supporting_source_ids": [
        "listing_platform_landwatch"
      ]
    }
  ],
  "top_risks": [
    {
      "risk_id": "parcel_identity_unconfirmed",
      "label": "Parcel Identity Unconfirmed",
      "severity": "high",
      "category": "identity",
      "summary": "The active subject is not yet anchored to one official parcel record.",
      "blocking": true,
      "citation_ids": [
        "c_f8a8c354"
      ]
    },
    {
      "risk_id": "flood_screen_incomplete",
      "label": "Flood Screen Incomplete",
      "severity": "medium",
      "category": "environmental",
      "summary": "Flood screening was not completed or lacked a defensible point/parcel geometry.",
      "blocking": true,
      "citation_ids": []
    },
    {
      "risk_id": "zoning_unresolved",
      "label": "Zoning Still Unresolved",
      "severity": "medium",
      "category": "zoning",
      "summary": "No parcel-specific zoning source was confirmed in Step 7.",
      "blocking": false,
      "citation_ids": []
    }
  ],
  "top_unknowns": [
    {
      "unknown_id": "missing_zoning",
      "question": "What authoritative source will resolve the missing zoning surface?",
      "why_it_matters": "A missing critical diligence surface lowers completeness and may change conclusions materially.",
      "blocking": true,
      "recommended_next_source": "zoning"
    },
    {
      "unknown_id": "subject_resolution_q_1",
      "question": "Which parcel or APN on this listing should be treated as the authoritative parcel target?",
      "why_it_matters": "Parcel-level diligence should not overclaim beyond the stabilized subject boundary.",
      "blocking": true,
      "recommended_next_source": "official_county_parcel_source"
    },
    {
      "unknown_id": "module_rural_hold_carry",
      "question": "What annual carry cost and local exit-liquidity profile should be assumed for a rural hold?",
      "why_it_matters": "A hold thesis can weaken quickly if taxes, carry costs, or exit timing are worse than expected.",
      "blocking": false,
      "recommended_next_source": "market_context"
    },
    {
      "unknown_id": "module_energy_solar_interconnection",
      "question": "What utility, substation, or interconnection path could actually support the solar thesis?",
      "why_it_matters": "Solar value can change materially once real power-delivery constraints are known.",
      "blocking": false,
      "recommended_next_source": "interconnection"
    }
  ],
  "next_actions": [
    {
      "priority": 1,
      "action": "collect_additional_identifiers",
      "reason": "Listing URL parsing alone does not anchor the listing to a confirmed parcel."
    },
    {
      "priority": 2,
      "action": "query_listing_page",
      "reason": "Listing-page retrieval is needed later to extract APN, address, acreage, and parcel clues."
    },
    {
      "priority": 3,
      "action": "resolve_zoning",
      "reason": "No registered source currently supports zoning strongly enough for this context."
    },
    {
      "priority": 4,
      "action": "retry_or_replace_federal_epa_ejscreen",
      "reason": "HTTP status 404 returned from https://www.epa.gov/ejscreen"
    },
    {
      "priority": 20,
      "action": "estimate_rural_hold_carry_and_exit",
      "reason": "A rural-hold thesis improves materially once carry costs and exit liquidity are bounded."
    }
  ],
  "source_groups": [